Managed Function,MO Class,EBS MO,Counter,Counter Type,Counter Size,Compressed,Description,Condition,Related PM Event,Event Parameters for $ Separation,Applicable Filters,Filter Status,SupportedBands,SupportedDeployments,LimitationReason,CategoryType,CategoryArea,CategoryScenario
CUUP,RpUserPlaneLink,CUUP_LINK,pmEbsnPdcpVolUlCmpHdrProf2Rohc5qi,ACC,PDF[256],True,Total volume of PDCP SDU headers compressed with Profile 2 received in the ROHC entity in the uplink for each 5QI. Unit: bytes,Continuous measurement for DRBs aggregated to RpUserPlaneLink.,CuUpPerUeRbCgTrafficRepAggr10,,"Qos, QosType, PlmnId, PrefUeGrpId, UeGrpId, UeMobilityGrpId, UeServiceGrpId, UeAdmissionGrpId, Snssai","USED, USED, USED, USED, USED, USED, USED, USED, USED","Low-band, Mid-band",NR SA,,PI,"Integrity, Utilization","Voice Quality, Uplink Volume"
CUUP,RpUserPlaneLink,CUUP_LINK,pmEbsnPdcpVolUlHdrProf1Rohc5qi,ACC,PDF[256],True,Total volume of PDCP SDU headers decompressed with Profile 1 transmitted from the ROHC entity in the uplink for each 5QI. Unit: bytes,Continuous measurement for DRBs aggregated to RpUserPlaneLink.,CuUpPerUeRbCgTrafficRepAggr10,,"Qos, QosType, PlmnId, PrefUeGrpId, UeGrpId, UeMobilityGrpId, UeServiceGrpId, UeAdmissionGrpId, Snssai","USED, USED, USED, USED, USED, USED, USED, USED, USED","Low-band, Mid-band",NR SA,,PI,"Integrity, Utilization","Voice Quality, Uplink Volume"
CUUP,RpUserPlaneLink,CUUP_LINK,pmEbsnPdcpVolUlHdrProf2Rohc5qi,ACC,PDF[256],True,Total volume of PDCP SDU headers decompressed with Profile 2 transmitted from the ROHC entity in the uplink for each 5QI. Unit: bytes,Continuous measurement for DRBs aggregated to RpUserPlaneLink.,CuUpPerUeRbCgTrafficRepAggr10,,"Qos, QosType, PlmnId, PrefUeGrpId, UeGrpId, UeMobilityGrpId, UeServiceGrpId, UeAdmissionGrpId, Snssai","USED, USED, USED, USED, USED, USED, USED, USED, USED","Low-band, Mid-band",NR SA,,PI,"Integrity, Utilization","Voice Quality, Uplink Volume"
CUUP,RpUserPlaneLink,CUUP_LINK,pmEbsnPktLossDlDistr,ACC,32,False,Packet (PDCP PDUs) loss rate in radio processing user plane in downlink. Ranges: Bin[0]: [0..0.1[ % Bin[1]: [0.1..0.2[ % Bin[2]: [0.2..0.3[ % Bin[3]: [0.3..0.4[ % Bin[4]: [0.4..0.5[ % Bin[5]: [0.5..0.6[ % Bin[6]: [0.6..0.7[ % Bin[7]: [0.7..0.8[ % Bin[8]: [0.8..0.9[ % Bin[9]: [0.9..1[ % Bin[10]: [1..1.5[ % Bin[11]: [1.5..2[ % Bin[12]: [2..2.5[ % Bin[13]: [2.5..3[ % Bin[14]: [3..4[ % Bin[15]: [4..5[ % Bin[16]: [5..6[ % Bin[17]: [6..7[ % Bin[18]: [7..8[ % Bin[19]: [8..9[ % Bin[20]: [9..10[ % Bin[21]: [10..15[ % Bin[22]: [15..20[ % Bin[23]: [20..25[ % Bin[24]: [25..30[ % Bin[25]: [30..40[ % Bin[26]: [40..50[ % Bin[27]: [50..60[ % Bin[28]: [60..70[ % Bin[29]: [70..80[ % Bin[30]: [80..90[ % Bin[31]: [90..100] %,"Stepped for each bearer (and each cell group if using dual connectivity) every 10 seconds, showing share of packets (PDCP PDUs) lost in radio processing user plane in downlink during that time.",CuUpPerUeRbCgTrafficRepAggr10,,"Qos, QosType, PlmnId, PrefUeGrpId, UeGrpId, UeMobilityGrpId, UeServiceGrpId, UeAdmissionGrpId, Snssai","USED, USED, USED, USED, USED, USED, USED, USED, USED","Low-band, Mid-band, High-band","EN-DC, NR SA",Not supported in HB SA,KPI,Integrity,PDCP Packet Integrity
CUUP,RpUserPlaneLink,CUUP_LINK,pmEbsnPktLossUlDistr,ACC,32,False,Packet (PDCP PDUs) loss rate in radio processing user plane in uplink. Ranges: Bin[0]: [0..0.1[ % Bin[1]: [0.1..0.2[ % Bin[2]: [0.2..0.3[ % Bin[3]: [0.3..0.4[ % Bin[4]: [0.4..0.5[ % Bin[5]: [0.5..0.6[ % Bin[6]: [0.6..0.7[ % Bin[7]: [0.7..0.8[ % Bin[8]: [0.8..0.9[ % Bin[9]: [0.9..1[ % Bin[10]: [1..1.5[ % Bin[11]: [1.5..2[ % Bin[12]: [2..2.5[ % Bin[13]: [2.5..3[ % Bin[14]: [3..4[ % Bin[15]: [4..5[ % Bin[16]: [5..6[ % Bin[17]: [6..7[ % Bin[18]: [7..8[ % Bin[19]: [8..9[ % Bin[20]: [9..10[ % Bin[21]: [10..15[ % Bin[22]: [15..20[ % Bin[23]: [20..25[ % Bin[24]: [25..30[ % Bin[25]: [30..40[ % Bin[26]: [40..50[ % Bin[27]: [50..60[ % Bin[28]: [60..70[ % Bin[29]: [70..80[ % Bin[30]: [80..90[ % Bin[31]: [90..100] %,"Stepped for each bearer (and each cell group if using dual connectivity) every 10 seconds, showing share of packets (PDCP PDUs) lost in radio processing user plane in uplink during that time.",CuUpPerUeRbCgTrafficRepAggr10,,"Qos, QosType, PlmnId, PrefUeGrpId, UeGrpId, UeMobilityGrpId, UeServiceGrpId, UeAdmissionGrpId, Snssai","USED, USED, USED, USED, USED, USED, USED, USED, USED","Low-band, Mid-band, High-band","EN-DC, NR SA",Not supported in HB SA,KPI,Integrity,PDCP Packet Integrity
CUUP,S1ULink,CUUP_LINK,pmEbsnPdcpPktRecDlCongMarkQci,ACC,PDF[256],True,Total number of L4S CE marked packets (PDCP SDUs) for each QCI on S1-U in downlink.,Stepped when downlink PDCP SDUs are congestion marked for each QCI.,CuUpPerUeRbS1NgTrafficRepAggr10,,"Qos, QosType, PlmnId, PrefUeGrpId, UeGrpId, UeMobilityGrpId, UeServiceGrpId, UeAdmissionGrpId, Snssai","USED, USED, USED, USED, USED, USED, USED, USED, USED","Low-band, Mid-band, High-band",EN-DC,,PI,Integrity,PDCP Packet Integrity
CUUP,S1ULink,CUUP_LINK,pmEbsnPdcpPktRecDlDiscAqmQci,ACC,PDF[256],True,Total number of packets (PDCP SDUs) discarded for each QCI over S1-U in downlink because of AQM.,Stepped when DL PDCP SDUs are discarded because of AQM for each QCI.,CuUpPerUeRbS1NgTrafficRepAggr10,,"Qos, QosType, PlmnId, PrefUeGrpId, UeGrpId, UeMobilityGrpId, UeServiceGrpId, UeAdmissionGrpId, Snssai","USED, USED, USED, USED, USED, USED, USED, USED, USED","Low-band, Mid-band, High-band",EN-DC,,KPI,Integrity,PDCP Packet Integrity
CUUP,S1ULink,CUUP_LINK,pmEbsnPdcpPktRecDlDiscQci,ACC,PDF[256],True,Total number of packets (PDCP SDUs) discarded for each QCI over S1-U in downlink.,Stepped when DL PDCP SDUs are discarded for each QCI.,CuUpPerUeRbS1NgTrafficRepAggr10,,"Qos, QosType, PlmnId, PrefUeGrpId, UeGrpId, UeMobilityGrpId, UeServiceGrpId, UeAdmissionGrpId, Snssai","USED, USED, USED, USED, USED, USED, USED, USED, USED","Low-band, Mid-band, High-band",EN-DC,,KPI,Integrity,PDCP Packet Integrity
CUUP,S1ULink,CUUP_LINK,pmEbsnPdcpPktRecDlQci,ACC,PDF[256],True,Total number of packets (PDCP SDUs) received for each QCI over S1-U in downlink.,Stepped when DL PDCP SDUs are received for each QCI.,CuUpPerUeRbS1NgTrafficRepAggr10,,"Qos, QosType, PlmnId, PrefUeGrpId, UeGrpId, UeMobilityGrpId, UeServiceGrpId, UeAdmissionGrpId, Snssai","USED, USED, USED, USED, USED, USED, USED, USED, USED","Low-band, Mid-band, High-band",EN-DC,,KPI,Integrity,PDCP Packet Integrity
DU,GNBDUFunction,DU,pmEbsDuExampleCounter,ACC,Single,,This is an example DU counter,This is an example DU counter,DuTestEventEnm,,,,"Low-band, Mid-band, High-band","EN-DC, NR SA",,PI,Undefined,Test counter
DU,NRCellDU,DU_CELL,pmEbsActiveUeDlMax,MAX,Single,,"Peak number of active UEs that have DRB data in UE dedicated downlink buffer. Value is maximum of a set of samples, where following conditions apply: - Throughout measurement period, each sample is an average of active UEs. Rounding method can cause counter to show one less than real number of UEs. - Sample is taken every second. Unit: N/A",Set to maximum of all average samples of (ActiveUeSum divided by ActiveUeSamp) made over ROP. Includes only those UEs that have control plane termination in this cell.,DuPerCellTrafficRep,,,,"Low-band, Mid-band, High-band","EN-DC, NR SA",Not supported in HB SA,RI,Utilization,Active UE
DU,NRCellDU,DU_CELL,pmEbsActiveUeDlSamp,ACC,Single,,Number of times corresponding pmActiveUeDlSum counter is incremented. Unit: N/A,Stepped at every update of sum counter when there is at least one active UE. Stepped when corresponding sum counter is scanned.,DuPerCellTrafficRep,,,,"Low-band, Mid-band, High-band","EN-DC, NR SA",Not supported in HB SA,RI,Utilization,Active UE
DU,NRCellDU,DU_CELL,pmEbsActiveUeDlSum,ACC,Single,,Number of active UE instances that have DRB data in UE-dedicated downlink buffer. Unit: N/A,Stepped for each active UE instance in each slot.,DuPerCellTrafficRep,,,,"Low-band, Mid-band, High-band","EN-DC, NR SA",Not supported in HB SA,RI,Utilization,Active UE
DU,NRCellDU,DU_CELL,pmEbsActiveUeDlTrueSamp,ACC,Single,,"Number of times corresponding pmActiveUeDlSum counter is updated, regardless if there are any active UEs, that is, once every slot. Unit: N/A",Stepped when corresponding sum counter is scanned.,DuPerCellTrafficRep,,,,"Low-band, Mid-band, High-band","EN-DC, NR SA",Not supported in HB SA,RI,Utilization,Active UE
DU,NRCellDU,DU_CELL,pmEbsActiveUeUlMax,MAX,Single,,"Peak number of active UEs that have DRB or SRB data in UE uplink buffer. Value is maximum of a set of samples, where following conditions apply: - Throughout measurement period, each sample is an average of active UEs. Rounding method can cause counter to show one less than real number of UEs. - Sample is taken every second. Unit: N/A",Set to maximum of all average samples of (ActiveUeSum divided by ActiveUeSamp) made over ROP. Includes only those UEs that have control plane termination in this cell.,DuPerCellTrafficRep,,,,"Low-band, Mid-band, High-band","EN-DC, NR SA",Not supported in HB SA,RI,Utilization,Active UE
DU,NRCellDU,DU_CELL,pmEbsActiveUeUlSamp,ACC,Single,,Number of times corresponding pmActiveUeUlSum counter is incremented. Unit: N/A,Stepped at every update of sum counter when there is at least one active UE. Stepped when corresponding sum counter is scanned.,DuPerCellTrafficRep,,,,"Low-band, Mid-band, High-band","EN-DC, NR SA",Not supported in HB SA,RI,Utilization,Active UE
DU,NRCellDU,DU_CELL,pmEbsActiveUeUlSum,ACC,Single,,Number of UE instances considered active in uplink direction. UE is considered to have DRB or SRB data in its buffer. Unit: N/A,Stepped for each active UE instance in each slot.,DuPerCellTrafficRep,,,,"Low-band, Mid-band, High-band","EN-DC, NR SA",Not supported in HB SA,RI,Utilization,Active UE
DU,NRCellDU,DU_CELL,pmEbsActiveUeUlTrueSamp,ACC,Single,,"Number of times corresponding pmActiveUeUlSum counter is updated, regardless if there are any active UEs, that is, once every slot. Unit: N/A",Stepped when corresponding sum counter is scanned.,DuPerCellTrafficRep,,,,"Low-band, Mid-band, High-band","EN-DC, NR SA",Not supported in HB SA,RI,Utilization,Active UE
DU,NRCellDU,DU_CELL,pmEbsCellDowntimeAuto,ACC,Single,,Period when cell is disabled because NRCellDU.serviceStatus is set to OUT_OF_SERVICE. Incremented only when gNodeB is operational. Unit: seconds,Stepped each second when conditions are met.,DuPerNRCellDUDowntime,,,,"Low-band, Mid-band, High-band","EN-DC, NR SA",,KPI,Availability,Cell Availability
DU,NRCellDU,DU_CELL,pmEbsCellDowntimeMan,ACC,Single,,"Period when cell is disabled because NRCellDU.administrativeState, or another MO the cell depends on, is locked by operator. Incremented only when gNodeB is operational. Unit: seconds",Stepped each second when conditions are met.,DuPerNRCellDUDowntime,,,,"Low-band, Mid-band, High-band","EN-DC, NR SA",,KPI,Availability,Cell Availability
DU,NRCellDU,DU_CELL,pmEbsDrbEstabFailSchdRateReject,ACC,Single,,Number of rejected establishments of DRB with rate-controlled schedulers. Rejection caused by attempt to use more rate-controlled schedulers than limit and DRB overload handling is set to REJECT.,Stepped when DRB establishment with rate-controlled scheduling algorithm was rejected due to DRB overload handling setting REJECT.,"DuProcUeContextModification, DuProcUeContextSetup",,"DuProcUeContextModification: Qos, QosType, PrefUeGrpId, UeGrpId, UeMobilityGrpId, UeServiceGrpId, UeAdmissionGrpId, DuProcUeContextSetup: PrefUeGrpId, UeGrpId, PlmnId, Qos, QosType, UeMobilityGrpId, UeServiceGrpId, UeAdmissionGrpId","DuProcUeContextModification: USED, USED, USED, USED, USED, USED, USED, DuProcUeContextSetup: USED, USED, USED, USED, USED, USED, USED, USED","Low-band, Mid-band","EN-DC, NR SA",,PI,Accessibility,"DRB Establishment, Rate-controlled Scheduling"
DU,NRCellDU,DU_CELL,pmEbsDrbEstabSuccDynSlotAggrAllowed5qi,ACC,PDF[256],True,Number of successful DRB establishments with configured Dynamic Slot Aggregation for each 5QI. Unit: N/A,Stepped when DRB is successfully established with configured Dynamic Slot Aggregation.,"DuProcUeContextModification, DuProcUeContextSetup",,"DuProcUeContextModification: Qos, QosType, PrefUeGrpId, UeGrpId, UeMobilityGrpId, UeServiceGrpId, UeAdmissionGrpId, DuProcUeContextSetup: PrefUeGrpId, UeGrpId, PlmnId, Qos, QosType, UeMobilityGrpId, UeServiceGrpId, UeAdmissionGrpId","DuProcUeContextModification: USED, USED, USED, USED, USED, USED, USED, DuProcUeContextSetup: USED, USED, USED, USED, USED, USED, USED, USED","Low-band, Mid-band",NR SA,,PI,Accessibility,Drb Establishment
DU,NRCellDU,DU_CELL,pmEbsDrbEstabSuccDynSlotAggrNotCapable5qi,ACC,PDF[256],True,"Number of successful DRB establishments without configured Dynamic Slot Aggregation due to not capable UE, for each 5QI. Unit: N/A","Stepped when DRB is successfully established, without configured Dynamic Slot Aggregation due to UE not supporting PUSCH Repetition Type A.","DuProcUeContextModification, DuProcUeContextSetup",,"DuProcUeContextModification: Qos, QosType, PrefUeGrpId, UeGrpId, UeMobilityGrpId, UeServiceGrpId, UeAdmissionGrpId, DuProcUeContextSetup: PrefUeGrpId, UeGrpId, PlmnId, Qos, QosType, UeMobilityGrpId, UeServiceGrpId, UeAdmissionGrpId","DuProcUeContextModification: USED, USED, USED, USED, USED, USED, USED, DuProcUeContextSetup: USED, USED, USED, USED, USED, USED, USED, USED","Low-band, Mid-band",NR SA,,PI,Accessibility,Drb Establishment
DU,NRCellDU,DU_CELL,pmEbsDrbEstabSuccSchdRate,ACC,Single,,Number of successful establishments of DRB that requested rate-controlled schedulers.,Stepped when DRB is successfully established with requested rate-controlled scheduler or with rate-controlled scheduler with basic QoS.,"DuProcUeContextModification, DuProcUeContextSetup",,"DuProcUeContextModification: Qos, QosType, PrefUeGrpId, UeGrpId, UeMobilityGrpId, UeServiceGrpId, UeAdmissionGrpId, DuProcUeContextSetup: PrefUeGrpId, UeGrpId, PlmnId, Qos, QosType, UeMobilityGrpId, UeServiceGrpId, UeAdmissionGrpId","DuProcUeContextModification: USED, USED, USED, USED, USED, USED, USED, DuProcUeContextSetup: USED, USED, USED, USED, USED, USED, USED, USED","Low-band, Mid-band","EN-DC, NR SA",,PI,Accessibility,"DRB Establishment, Rate-controlled Scheduling"
DU,NRCellDU,DU_CELL,pmEbsDrbEstabSuccSchdRateBasic,ACC,Single,,Number of successful DRB establishments with rate-controlled schedulers with basic QoS. Basic QoS is default scheduling algorithm of RESOURCE FAIR and priority domain 48.,Stepped when DRB is successfully established with basic QoS but rate-controlled scheduler is requested.,"DuProcUeContextModification, DuProcUeContextSetup",,"DuProcUeContextModification: Qos, QosType, PrefUeGrpId, UeGrpId, UeMobilityGrpId, UeServiceGrpId, UeAdmissionGrpId, DuProcUeContextSetup: PrefUeGrpId, UeGrpId, PlmnId, Qos, QosType, UeMobilityGrpId, UeServiceGrpId, UeAdmissionGrpId","DuProcUeContextModification: USED, USED, USED, USED, USED, USED, USED, DuProcUeContextSetup: USED, USED, USED, USED, USED, USED, USED, USED","Low-band, Mid-band","EN-DC, NR SA",,PI,Accessibility,"DRB Establishment, Rate-controlled Scheduling"
DU,NRCellDU,DU_CELL,pmEbsDrbEstabSuccSrDelayNotCapable5qi,ACC,PDF[256],True,Number of successful DRB establishments without configured Scheduling Request (SR) delay for each 5QI. No SR delay is configured because UE does not support it. Unit: N/A,Stepped when DRB is successfully established without configured PUCCH SR because UE does not support SR delay configuration.,"DuProcUeContextModification, DuProcUeContextSetup",,"DuProcUeContextModification: Qos, QosType, PrefUeGrpId, UeGrpId, UeMobilityGrpId, UeServiceGrpId, UeAdmissionGrpId, DuProcUeContextSetup: PrefUeGrpId, UeGrpId, PlmnId, Qos, QosType, UeMobilityGrpId, UeServiceGrpId, UeAdmissionGrpId","DuProcUeContextModification: USED, USED, USED, USED, USED, USED, USED, DuProcUeContextSetup: USED, USED, USED, USED, USED, USED, USED, USED","Low-band, Mid-band",NR SA,Status Preliminary,PI,Accessibility,DRB Establishment
DU,NRCellDU,DU_CELL,pmEbsDrbModFailSchdRateReject,ACC,Single,,Number of rejected modifications of existing DRB to use rate-controlled schedulers. Rejection caused by attempt to use more rate-controlled schedulers than limit and DRB overload handling is set to REJECT.,Stepped when DRB modification with rate-controlled scheduling algorithm was rejected due to DRB overload handling setting REJECT.,DuProcUeContextModification,,"Qos, QosType, PrefUeGrpId, UeGrpId, UeMobilityGrpId, UeServiceGrpId, UeAdmissionGrpId","USED, USED, USED, USED, USED, USED, USED","Low-band, Mid-band","EN-DC, NR SA",,PI,Accessibility,"DRB Modification, Rate-controlled Scheduling"
DU,NRCellDU,DU_CELL,pmEbsDrbModSuccSchdRate,ACC,Single,,Number of successful DRB modifications with rate-controlled schedulers.,Stepped when DRB is successfully modified with requested rate-controlled scheduler or with rate-controlled scheduler with basic QoS.,DuProcUeContextModification,,"Qos, QosType, PrefUeGrpId, UeGrpId, UeMobilityGrpId, UeServiceGrpId, UeAdmissionGrpId","USED, USED, USED, USED, USED, USED, USED","Low-band, Mid-band","EN-DC, NR SA",,PI,Accessibility,DRB Modification
DU,NRCellDU,DU_CELL,pmEbsDrbModSuccSchdRateBasic,ACC,Single,,Number of successful DRB modifications with rate-controlled schedulers with basic QoS. Basic QoS is default scheduling algorithm of RESOURCE FAIR and priority domain 48.,Stepped when DRB is successfully modified with rate-controlled schedulers with basic QoS.,DuProcUeContextModification,,"Qos, QosType, PrefUeGrpId, UeGrpId, UeMobilityGrpId, UeServiceGrpId, UeAdmissionGrpId","USED, USED, USED, USED, USED, USED, USED","Low-band, Mid-band","EN-DC, NR SA",,PI,Accessibility,"Drb Modification, Rate-controlled Scheduling"
DU,NRCellDU,DU_CELL,pmEbsMacLatTimeDlDrxSyncQos,ACC,PDF[256],True,Aggregated time for downlink MAC latency measurement for each QoS with DRX impact but without out-of-sync impact. DL MAC latency measures MAC scheduling latency between reception of packet in empty DL buffer and transmission of first packet. Unit: 125 microseconds,"Stepped at DL MAC latency measurement when the following conditions apply: - UE is in DRX_SLEEP state and in UL in-sync state. - First packet is received in empty DL buffer. In case of carrier aggregation, first packet transmission can be in PCell or SCell. Counter is accumulated in PCell.",DuPerCellQosTrafficRep,,"Qos, QosType","USED, USED","Low-band, Mid-band, High-band","EN-DC, NR SA",,KPI,Integrity,"Latency and Delay, Discontinuous Reception"
DU,NRCellDU,DU_CELL,pmEbsMacLatTimeDlDrxSyncSampQos,ACC,PDF[256],True,Aggregated number of samples for downlink MAC latency measurements for each QoS with DRX impact but without out-of-sync impact. DL MAC latency measures MAC scheduling latency between reception of packet in empty DL buffer and transmission of first packet. Unit: N/A,"Stepped at DL MAC latency measurement when the following conditions apply: - UE is in DRX_SLEEP state and in UL in-sync state. - First packet is received in empty DL buffer. In case of carrier aggregation, first packet transmission can be in PCell or SCell. Counter is accumulated in PCell.",DuPerCellQosTrafficRep,,"Qos, QosType","USED, USED","Low-band, Mid-band, High-band","EN-DC, NR SA",,KPI,Integrity,"Latency and Delay, Discontinuous Reception"
DU,NRCellDU,DU_CELL,pmEbsMacLatTimeDlNoDrxSyncQos,ACC,PDF[256],True,Aggregated time for downlink MAC latency measurement for each QoS without DRX impact and out-of-sync impact. DL MAC latency measures MAC scheduling latency between reception of packet in an empty DL buffer and transmission of first packet. Unit: 125 microseconds,"Stepped at DL MAC latency when the following conditions apply: - UE is in DRX_ACTIVE state and in UL in-sync state. - First packet is received in empty DL buffer. In case of carrier aggregation, first packet transmission can be in PCell or SCell. Counter is accumulated in PCell.",DuPerCellQosTrafficRep,,"Qos, QosType","USED, USED","Low-band, Mid-band, High-band","EN-DC, NR SA",,KPI,Integrity,"Latency and Delay, Discontinuous Reception"
DU,NRCellDU,DU_CELL,pmEbsMacLatTimeDlNoDrxSyncSampQos,ACC,PDF[256],True,Aggregated number of samples for downlink MAC latency measurements for each QoS without DRX and out-of-sync impact. DL MAC latency measures MAC scheduling latency between reception of packet in empty DL buffer and transmission of first packet. Unit: N/A,"Stepped at DL MAC latency measurement when the following conditions apply: - UE is in DRX_ACTIVE state and in UL in-sync state. - First packet is received in empty DL buffer. In case of carrier aggregation, first packet transmission can be in PCell or SCell. Counter is accumulated in PCell.",DuPerCellQosTrafficRep,,"Qos, QosType","USED, USED","Low-band, Mid-band, High-band","EN-DC, NR SA",,KPI,Integrity,"Latency and Delay, Discontinuous Reception"
DU,NRCellDU,DU_CELL,pmEbsMacRBSymAvailDl,ACC,Single,,Aggregated number of resource block symbols available for downlink transmission during complete ROP. Unit: N/A,Stepped when DL resource block symbols are used in one of the following cases: - Based on configuration. - After considering spectrum sharing. - Regardless of being used for DL transmission or not.,DuPerCellResourceRep,,,,"Low-band, Mid-band, High-band","EN-DC, NR SA",,RI,Utilization,RBSym Resources
DU,NRCellDU,DU_CELL,pmEbsMacRBSymAvailPdcch,ACC,Single,,Aggregated number of resource block symbols configured for PDCCH during complete ROP. Unit: N/A,Stepped for each downlink resource block symbol configured for PDCCH for any type of scheduling of PDSCH or PUSCH. Configuration is maximum possible that is available even if symbols are not used for downlink transmission.,DuPerCellResourceRep,,,,"Low-band, Mid-band","EN-DC, NR SA",,RI,Utilization,PDCCH Resources
DU,NRCellDU,DU_CELL,pmEbsMacRBSymAvailUl,ACC,Single,,Aggregated number of resource block symbols available for uplink transmission during complete ROP. Unit: N/A,Stepped when uplink resource block symbols are available to use in one of following cases: - Based on configuration - After considering spectrum sharing,DuPerCellResourceRep,,,,"Low-band, Mid-band, High-band","EN-DC, NR SA",,RI,Utilization,RBSym Resources
DU,NRCellDU,DU_CELL,pmEbsMacRBSymCsiRs,ACC,Single,,"Aggregated number of resource block symbols used for CSI-RS, TRS, and CSI-IM during complete ROP. Unit: N/A","Incremented for each downlink resource block symbol used for CSI-RS, including TRS and CSI-IM. Truncation of (Number of resource element symbols / 12) is equal to number of resource block symbols.",DuPerCellResourceRep,,,,"Low-band, Mid-band, High-band","EN-DC, NR SA",,RI,Utilization,RBSym Resources
DU,NRCellDU,DU_CELL,pmEbsMacRBSymUsedMaxDlPartition,MAX,Single,,Measures maximum normal partition utilization for downlink resource block symbols.,Updated at end of ROP with maximum value during ROP. Provides maximum value reported by periodic sampling.,DuPerCellpartitionResourceRep,,"PartitionId, ServiceId","USED, USED","Low-band, Mid-band","EN-DC, NR SA",,PI,Utilization,RBSym Resources
DU,NRCellDU,DU_CELL,pmEbsMacRBSymUsedMaxUlPartition,MAX,Single,,Measures maximum normal partition utilization for uplink resource block symbols.,Updated at end of ROP with maximum value during ROP. Provides maximum value reported by periodic sampling.,DuPerCellpartitionResourceRep,,"PartitionId, ServiceId","USED, USED","Low-band, Mid-band","EN-DC, NR SA",,PI,Utilization,RBSym Resources
DU,NRCellDU,DU_CELL,pmEbsMacRBSymUsedPdcchTypeA,ACC,Single,,Aggregated number of resource block symbols used by PDCCH for scheduling of PDSCH or PUSCH using mapping type A. DMRS and PTRS embedded in resources are included. Unit: N/A,Incremented for each downlink resource block symbol used by PDCCH for scheduling of PDSCH or PUSCH using mapping type A.,DuPerCellResourceRep,,,,"Low-band, Mid-band, High-band","EN-DC, NR SA",,RI,Utilization,PDCCH Resources
DU,NRCellDU,DU_CELL,pmEbsMacRBSymUsedPdcchTypeB,ACC,Single,,Aggregated number of resource block symbols used by PDCCH for scheduling of PDSCH or PUSCH using mapping type B. DMRS and PTRS embedded in resources are included. Unit: N/A,Incremented for each downlink resource block symbol used by PDCCH for scheduling of PDSCH or PUSCH using mapping type B.,DuPerCellResourceRep,,,,High-band,"EN-DC, NR SA",,RI,Utilization,PDCCH Resources
DU,NRCellDU,DU_CELL,pmEbsMacRBSymUsedPdschTypeA,ACC,Single,,Aggregated number of resource block symbols used for PDSCH mapping type A during complete ROP. DMRS and PTRS embedded in PDSCH resources are included. Unit: N/A,Incremented for each downlink resource block symbol used for PDSCH resource element mapping type A.,DuPerCellResourceRep,,,,"Low-band, Mid-band, High-band","EN-DC, NR SA",,RI,Utilization,PDSCH Resources
DU,NRCellDU,DU_CELL,pmEbsMacRBSymUsedPdschTypeABroadcasting,ACC,Single,,Aggregated number of resource block symbols used for PDSCH mapping type A broadcasting during complete ROP. DMRS and PTRS embedded in PDSCH resources are included. Unit: N/A,"Incremented for each downlink resource block symbol used for PDSCH resource element mapping type A broadcasting. Counts DL resource block symbols used for Synchronization Signal (SS) PBCH, BCCH, and PCCH including SIBs and Random Access (RA) Msg2.",DuPerCellResourceRep,,,,"Low-band, Mid-band, High-band","EN-DC, NR SA",,RI,Utilization,PDSCH Resources
DU,NRCellDU,DU_CELL,pmEbsMacRBSymUsedPuschTypeA,ACC,Single,,Aggregated number of resource block symbols used for PUSCH mapping type A during complete ROP. DMRS and PTRS embedded in PUSCH resources are included. Unit: N/A,Incremented for each downlink resource block symbol used for PUSCH mapping type A.,DuPerCellResourceRep,,,,"Low-band, Mid-band","EN-DC, NR SA",,RI,Utilization,PUSCH Resources
