Managed Function,MO Class,EBS MO,Counter,Counter Type,Counter Size,Compressed,Description,Condition,Related PM Event,Event Parameters for $ Separation,Applicable Filters,Filter Status,SupportedBands,SupportedDeployments,LimitationReason,CategoryType,CategoryArea,CategoryScenario
CUCP,NRCellCU,CU_CELL,pmEbsRrcResumeSuccFallback,ACC,Single,,Number of successfully completed RRC Connection Resume Fallback to RRC Connection Establishment procedures.,Stepped when RRCSetupComplete message is received after transmission of RRCSetup message in gNodeB-CU for RRC Connection Resume Fallback to RRC Connection Establishment procedure.,CuCpProcRrcResume,,"PrefUeGrpId, UeGrpId, PlmnId, Qos, Snssai, Arp, UeMobilityGrpId, UeServiceGrpId, UeAdmissionGrpId, UeAdmissionPriority","USED, USED, USED, USED, USED, USED, USED, USED, USED, USED","Low-band, Mid-band",NR SA,,KPI,Accessibility,RRC Connection Resume
CUCP,NRCellCU,CU_CELL,pmEbsRrcResumeSuccFallbackResumeCause$,ACC,Single,,Number of successfully completed RRC Connection Resume Fallback to RRC Connection Establishment procedures. Separate counter for each resume cause.,Stepped for each successful RRC Connection Resume Fallback to RRC Connection Establishment procedure.,CuCpProcRrcResume,rrc_resume_cause,"PrefUeGrpId, UeGrpId, PlmnId, Qos, Snssai, Arp, UeMobilityGrpId, UeServiceGrpId, UeAdmissionGrpId, UeAdmissionPriority","USED, USED, USED, USED, USED, USED, USED, USED, USED, USED","Low-band, Mid-band",NR SA,,PI,Accessibility,RRC Connection Resume
CUCP,NRCellCU,CU_CELL,pmEbsRrcResumeSuccResume,ACC,Single,,Number of successful RRC connection resumptions followed by RRC Resume procedure.,Stepped when RRCResumeComplete message is received after transmission of RRCResume message in gNodeB-CU.,CuCpProcRrcResume,,"PrefUeGrpId, UeGrpId, PlmnId, Qos, Snssai, Arp, UeMobilityGrpId, UeServiceGrpId, UeAdmissionGrpId, UeAdmissionPriority","USED, USED, USED, USED, USED, USED, USED, USED, USED, USED","Low-band, Mid-band",NR SA,,KPI,Accessibility,RRC Connection Resume
CUCP,NRCellCU,CU_CELL,pmEbsRrcResumeSuccResumeResumeCause$,ACC,Single,,Number of successful RRC connection resumptions followed by RRC Resume procedure. Separated counter for each resume cause.,Stepped when RRCResumeComplete message is received after transmission of RRCResume message in gNodeB-CU.,CuCpProcRrcResume,rrc_resume_cause,"PrefUeGrpId, UeGrpId, PlmnId, Qos, Snssai, Arp, UeMobilityGrpId, UeServiceGrpId, UeAdmissionGrpId, UeAdmissionPriority","USED, USED, USED, USED, USED, USED, USED, USED, USED, USED","Low-band, Mid-band",NR SA,,PI,Accessibility,RRC Connection Resume
CUCP,NRCellCU,CU_CELL,pmEbsRrcUaiOverheating,ACC,Single,,"Number of UE Assistance Information messages received with overheating assistance information. See 3GPP TS 38.331, UE Assistance Information.",Stepped when UEAssistanceInformation message with overheating assistance information for FR1 or FR2 is received at gNodeB-CU.,CuCpRrcUeAssistanceInformation,,,,"Low-band, Mid-band",NR SA,,PI,Integrity,RRC UE Assistance Information
CUCP,NRCellCU,CU_CELL,pmEbsRrcUaiOverheatingMiti,ACC,Single,,"Number of UE Assistance Information messages received with overheating assistance information indicating that UE overheating is mitigated. See 3GPP TS 38.331, RRC UE Assistance Information.",Stepped when UEAssistanceInformation message with empty overheating assistance information is received at gNodeB-CU.,CuCpRrcUeAssistanceInformation,,,,"Low-band, Mid-band",NR SA,,PI,Integrity,RRC UE Assistance Information
CUCP,NRCellCU,CU_CELL,pmEbsRrcUaiRecRelPref$,ACC,Single,,Number of UEAssistanceInformation messages received for each releasePreference IE. Separate counter for each releasePreference IE received.,Stepped at reception of UEAssistanceInformation message in gNodeB-CU.,CuCpUeAssistanceInformation,release_preference,,,"Low-band, Mid-band",NR SA,Status Preliminary,PI,Integrity,RRC UE Assistance Information
CUCP,NRCellCU,CU_CELL,pmEbsRwrEutranUeSuccEpsfb,ACC,Single,,Number of UE Release with Redirection to E-UTRAN procedures triggered by EPS fallback.,"Stepped at reception of F1AP UE CONTEXT RELEASE COMPLETE message, for which corresponding request is triggered by EPS fallback.",CuCpRwrMobilityDecision,,"PrefUeGrpId, UeGrpId, UeMobilityGrpId, UeServiceGrpId, PlmnId","USED, USED, USED, USED, USED","Low-band, Mid-band",NR SA,,PI,Mobility,Release with Redirection
CUCP,NRCellCU,CU_CELL,pmEbsRwrEutranUeSuccEpsfbBlind,ACC,Single,,Number of UE release with redirect to E-UTRAN procedures triggered by EPS fallback of blind release with redirect.,"Stepped when F1AP UE CONTEXT RELEASE COMPLETE message is received, for which corresponding request is triggered by EPS fallback.",CuCpRwrMobilityDecision,,"PrefUeGrpId, UeGrpId, UeMobilityGrpId, UeServiceGrpId, PlmnId","USED, USED, USED, USED, USED","Low-band, Mid-band",NR SA,,PI,Mobility,Release with Redirection
CUCP,NRCellCU,CU_CELL,pmEbsRwrEutranUeSuccEpsfbMeasured,ACC,Single,,Number of UE release with redirect to E-UTRAN procedures triggered by EPS fallback of measured release with redirect.,"Stepped when F1AP UE CONTEXT RELEASE COMPLETE message is received, for which corresponding request is triggered by EPS fallback.",CuCpRwrMobilityDecision,,"PrefUeGrpId, UeGrpId, UeMobilityGrpId, UeServiceGrpId, PlmnId","USED, USED, USED, USED, USED","Low-band, Mid-band",NR SA,,PI,Mobility,Release with Redirection
CUCP,NRCellCU,CU_CELL,pmEbsRwrEutranUeSuccTrigger$,ACC,Single,,Number of UE Release with Redirection to E-UTRAN procedures. Separate counter for each cause of Release with Redirection. See Lists and Delta Lists CPI for applicable RwR trigger.,Stepped at sending F1AP UE CONTEXT RELEASE COMMAND message when embedded RRCRelease message contains redirectedCarrierInfo IE that indicates redirection to EUTRA carrier.,CuCpRwrMobilityDecision,rwr_trigger,"PrefUeGrpId, UeGrpId, UeMobilityGrpId, UeServiceGrpId, PlmnId","USED, USED, USED, USED, USED","Low-band, Mid-band",NR SA,,PI,Mobility,"Release with Redirection, Remote Interference"
CUCP,NRCellCU,CU_CELL,pmEbsRwrEutranUeSuccUeCapFailDu,ACC,Single,,Number of successful Release with Redirect to E-UTRAN procedures triggered by failure to set up UE Context in gNodeB-DU caused by unsuccessful UE capability check in gNodeB-DU.,Stepped when RRC RRCRelease message is sent.,CuCpRwrMobilityDecision,,"PrefUeGrpId, UeGrpId, UeMobilityGrpId, UeServiceGrpId, PlmnId","USED, USED, USED, USED, USED","Low-band, Mid-band, High-band","EN-DC, NR SA",EN-DC not supported,PI,"Accessibility, Mobility",- UE Capability Failure - Release with Redirection
CUCP,NRCellCU,CU_CELL,pmEbsRwrIntraNrUeSuccCoverage,ACC,Single,,"Number of UE release with redirect, to another NR frequency procedures triggered by poor coverage on current NR frequency.","Stepped when F1AP UE CONTEXT RELEASE RESPONSE message is received, for which corresponding request is triggered by poor NR coverage. Response does not indicate that RRCRelease message is not delivered to UE.",CuCpRwrMobilityDecision,,"PrefUeGrpId, UeGrpId, UeMobilityGrpId, UeServiceGrpId, PlmnId","USED, USED, USED, USED, USED","Low-band, Mid-band",NR SA,,PI,Mobility,Release with Redirection
CUCP,NRCellCU,CU_CELL,pmEbsRwrIntraNrUeSuccTrigger$,ACC,Single,,"Number of UE Release with Redirection to another NR Frequency procedures. Separate counter for each cause of Release with Redirection. See Lists and Delta Lists CPI for applicable RwR trigger. For High-Band standalone cases, counter enables random redirection to existing PCells within a single sector where redirectedCarrierInfo IE is included in RRCRelease message.",Stepped at sending F1AP UE CONTEXT RELEASE COMMAND message when embedded RRCRelease message contains redirectedCarrierInfo IE that indicates redirection to NR carrier.,CuCpRwrMobilityDecision,rwr_trigger,"PrefUeGrpId, UeGrpId, UeMobilityGrpId, UeServiceGrpId, PlmnId","USED, USED, USED, USED, USED","Low-band, Mid-band, High-band",NR SA,,PI,Mobility,"Release with Redirection, Remote Interference"
CUCP,NRCellCU,CU_CELL,pmEbsSessionTimeDrb5qi,ACC,PDF[256],True,Aggregated session time of released DRBs for each mapped 5QI in milliseconds.,Bin accumulates in-session time aggregated for DRBs with a certain 5QI. Bursty DRBs are considered to be in session if any data on any DRB (UL or DL) is transferred during the last 100 ms. Continuous DRBs are considered to be in session from the time of first data transfer (UL or DL) until 100 ms after the last data transfer. Session time of a DRB is only reported when DRB is released.,"CuCpProcPduSessionResourceModify, CuCpProcPduSessionResourceRelease, CuCpProcUeCtxtRel",,"CuCpProcPduSessionResourceModify: PrefUeGrpId, UeGrpId, UeMobilityGrpId, UeServiceGrpId, PlmnId, UePowerClass, CuCpProcPduSessionResourceRelease: PrefUeGrpId, UeGrpId, UeMobilityGrpId, UeServiceGrpId, PlmnId, CuCpProcUeCtxtRel: PrefUeGrpId, UeGrpId, UeMobilityGrpId, UeServiceGrpId, PlmnId, UeAdmissionGrpId, UeAdmissionPriority","CuCpProcPduSessionResourceModify: USED, USED, USED, USED, USED, USED, CuCpProcPduSessionResourceRelease: USED, USED, USED, USED, USED, CuCpProcUeCtxtRel: USED, USED, USED, USED, USED, USED, USED","Low-band, Mid-band, High-band",NR SA,,KPI,Retainability,"Session Time, Drb Release"
CUCP,NRCellCU,CU_CELL,pmEbsUacBarringCellUsageBg$,ACC,Single,,Aggregated time of UAC barring due to cell load. Unit: seconds Separate counter for each barring group.,Stepped at UAC evaluation when UAC barring is caused by cell load.,CuCpUnifiedAccessControl,barring_group_list[$index].barring_group_id,,,"Low-band, Mid-band, High-band",NR SA,,PI,Utilization,Access Barring
CUCP,NRCellCU,CU_CELL,pmEbsUacBarringProbDistrBg$,ACC,PDF[16],False,Distribution of time cell was barred for each barring probability. Unit: seconds Ranges: Bin[0]: Barring probability 0.05 Bin[1]: Barring probability 0.10 Bin[2]: Barring probability 0.15 Bin[3]: Barring probability 0.20 Bin[4]: Barring probability 0.25 Bin[5]: Barring probability 0.30 Bin[6]: Barring probability 0.40 Bin[7]: Barring probability 0.50 Bin[8]: Barring probability 0.60 Bin[9]: Barring probability 0.70 Bin[10]: Barring probability 0.75 Bin[11]: Barring probability 0.80 Bin[12]: Barring probability 0.85 Bin[13]: Barring probability 0.90 Bin[14]: Barring probability 0.95 Bin[15]: Barring probability 1.00 Separate counter for each barring group.,Stepped at UAC evaluation when calculated UAC barring probability for corresponding barring group is greater than or equal to 1%.,CuCpUnifiedAccessControl,barring_group_list[$index].barring_group_id,,,"Low-band, Mid-band, High-band",NR SA,,PI,Accessibility,Access Barring
CUCP,NRCellCU,CU_CELL,pmEbsUacBarringRejBg$,ACC,Single,,Aggregated time of UAC barring due to connection rejections. Unit: seconds Separate counter for each barring group.,Stepped at UAC evaluation when UAC barring is caused by connection rejections.,CuCpUnifiedAccessControl,barring_group_list[$index].barring_group_id,,,"Low-band, Mid-band, High-band",NR SA,,PI,Utilization,Access Barring
CUCP,NRCellCU,CU_CELL,pmEbsUeCtxtEstabAtt,ACC,Single,,Number of UE context establishment attempts.,"Stepped when attempt is made to establish UE context, using NGAP Initial Context Setup procedure.",CuCpProcInitialCtxtEstab,,"PrefUeGrpId, UeGrpId, UePowerClass, PlmnId, UeMobilityGrpId, UeServiceGrpId, UeAdmissionGrpId, UeAdmissionPriority","USED, USED, USED, USED, USED, USED, USED, USED","Low-band, Mid-band, High-band",NR SA,,KPI,Accessibility,UE Context Establishment
CUCP,NRCellCU,CU_CELL,pmEbsUeCtxtEstabFailAdmission,ACC,Single,,Number of UE context establishment attempts rejected by Priority-Based Admission Control.,Stepped when attempt to establish UE context using NGAP Initial Context Setup procedure is rejected by Priority-Based Admission Control.,CuCpProcInitialCtxtEstab,,"PrefUeGrpId, UeGrpId, UePowerClass, PlmnId, UeMobilityGrpId, UeServiceGrpId, UeAdmissionGrpId, UeAdmissionPriority","USED, USED, USED, USED, USED, USED, USED, USED","Low-band, Mid-band",NR SA,,PI,Accessibility,UE Context Establishment
CUCP,NRCellCU,CU_CELL,pmEbsUeCtxtEstabFailCauseGrp$NgCause$,ACC,Single,,Number of UE context establishment attempts that fail. Separate counter for each 3GPP cause group and cause from 3GPP TS 38.413.,Stepped when UE context is unsuccessfully established using NGAP Initial Context Setup procedure.,CuCpProcInitialCtxtEstab,"cause_group_3gpp, cause_3gpp","PrefUeGrpId, UeGrpId, UePowerClass, PlmnId, UeMobilityGrpId, UeServiceGrpId, UeAdmissionGrpId, UeAdmissionPriority","USED, USED, USED, USED, USED, USED, USED, USED","Low-band, Mid-band",NR SA,,PI,Accessibility,UE Context Establishment
CUCP,NRCellCU,CU_CELL,pmEbsUeCtxtEstabFailRedCapUeLimit,ACC,Single,,Number of RedCap UE Context Establishment attempts rejected because of cell capacity limit.,Stepped when attempt to establish RedCap UE context using NGAP Initial Context Setup procedure is rejected because of cell capacity limit.,CuCpProcInitialCtxtEstab,,"PrefUeGrpId, UeGrpId, UePowerClass, PlmnId, UeMobilityGrpId, UeServiceGrpId, UeAdmissionGrpId, UeAdmissionPriority","USED, USED, USED, USED, USED, USED, USED, USED","Low-band, Mid-band",NR SA,,PI,Accessibility,"UE Context Establishment, RedCap"
CUCP,NRCellCU,CU_CELL,pmEbsUeCtxtEstabLatDistr,ACC,20,False,Distribution of Initial Context Establishment latency. Unit: ms Ranges: Bin[0]: [0..20] ms Bin[1]: [21..30] ms Bin[2]: [31..40] ms Bin[3]: [41..50] ms Bin[4]: [51..60] ms Bin[5]: [61..70] ms Bin[6]: [71..80] ms Bin[7]: [81..90] ms Bin[8]: [91..100] ms Bin[9]: [101..110] ms Bin[10]: [111..120] ms Bin[11]: [121..130] ms Bin[12]: [131..140] ms Bin[13]: [141..150] ms Bin[14]: [151..160] ms Bin[15]: [161..170] ms Bin[16]: [171..180] ms Bin[17]: [181..190] ms Bin[18]: [191..200] ms Bin[19]: [200..] ms,Stepped for each NGAP: INITIAL CONTEXT SETUP RESPONSE message sent. Latency is between NGAP: INITIAL CONTEXT SETUP REQUEST message received and NGAP: INITIAL CONTEXT SETUP RESPONSE message sent.,CuCpProcInitialCtxtEstab,,"PrefUeGrpId, UeGrpId, UePowerClass, PlmnId, UeMobilityGrpId, UeServiceGrpId, UeAdmissionGrpId, UeAdmissionPriority","USED, USED, USED, USED, USED, USED, USED, USED","Low-band, Mid-band, High-band",NR SA,,PI,Integrity,Latency and Delay
CUCP,NRCellCU,CU_CELL,pmEbsUeCtxtEstabSucc,ACC,Single,,Number of successful UE context establishments.,Stepped when UE context is successfully established using NGAP Initial Context Setup procedure.,CuCpProcInitialCtxtEstab,,"PrefUeGrpId, UeGrpId, UePowerClass, PlmnId, UeMobilityGrpId, UeServiceGrpId, UeAdmissionGrpId, UeAdmissionPriority","USED, USED, USED, USED, USED, USED, USED, USED","Low-band, Mid-band, High-band",NR SA,,KPI,Accessibility,UE Context Establishment
CUCP,NRCellCU,CU_CELL,pmEbsUeCtxtRelAbnormalGnbActPe,ACC,Single,,Number of abnormal NR SA UE Context Release procedures initiated by gNodeB due to preemption. UE is considered in session at time of release.,Stepped at completion of NGAP UE Context Release procedure initiated by gNodeB due to preemption and UE is considered in session at the time of release.,CuCpProcUeCtxtRel,,"PrefUeGrpId, UeGrpId, UeMobilityGrpId, UeServiceGrpId, PlmnId, UeAdmissionGrpId, UeAdmissionPriority","USED, USED, USED, USED, USED, USED, USED","Low-band, Mid-band, High-band","NR SA, CR NR SA",,PI,Retainability,UE Context Release
CUCP,NRCellCU,CU_CELL,pmEbsUeCtxtRelAbnormalGnbPe,ACC,Single,,Number of abnormal NR SA UE Context Release procedures initiated by gNodeB due to preemption.,Stepped at completion of NGAP UE Context Release procedure initiated by gNodeB due to preemption.,CuCpProcUeCtxtRel,,"PrefUeGrpId, UeGrpId, UeMobilityGrpId, UeServiceGrpId, PlmnId, UeAdmissionGrpId, UeAdmissionPriority","USED, USED, USED, USED, USED, USED, USED","Low-band, Mid-band, High-band","NR SA, CR NR SA",,PI,Retainability,UE Context Release
CUCP,NRCellCU,CU_CELL,pmEbsUeCtxtRelNormalTsCaConf,ACC,Single,,Number of times frequencies are prioritized at UE Release due to traffic steering.,Stepped when frequencies are prioritized (in CellReselectionPriorities IE) due to traffic steering with message RrcRelease. Applicable only when TrStSaCellProfileUeCfg::actionAtRelease = CRP_MLC_CONDITIONAL or CA_CONF.,CuCpProcUeCtxtRel,,"PrefUeGrpId, UeGrpId, UeMobilityGrpId, UeServiceGrpId, PlmnId, UeAdmissionGrpId, UeAdmissionPriority","USED, USED, USED, USED, USED, USED, USED","Low-band, Mid-band, High-band",NR SA,Not supported in High-Band SA,PI,Mobility,Traffic steering at UE Release
CUCP,NRCellCU,CU_CELL,pmEbsUeCtxtRelNormalTsSubscriber,ACC,Single,,Number of times subscriber-specific frequencies are prioritized at UE release.,Stepped when subscriber-specific frequencies are prioritized.,CuCpProcUeCtxtRel,,"PrefUeGrpId, UeGrpId, UeMobilityGrpId, UeServiceGrpId, PlmnId, UeAdmissionGrpId, UeAdmissionPriority","USED, USED, USED, USED, USED, USED, USED","Low-band, Mid-band, High-band",NR SA,,PI,Mobility,Traffic steering at UE Release
CUCP,NRCellCU,CU_CELL,pmEbsUeCtxtRetrieveAttRrcReest,ACC,Single,,"Number of attempted Retrieve UE Context procedures triggered by RRC Connection Reestablishment procedure. See 3GPP TS 38.423, Retrieve UE Context Request.",Stepped when XnAP RETRIEVE UE CONTEXT REQUEST message is received and UE Context is found in the last serving gNodeB.,CuCpProcXnRetrieveUeCtxt,,"PlmnId, PrefUeGrpId, UeGrpId","USED, USED, USED","Low-band, Mid-band",NR SA,,PI,Retainability,"RRC Connection Reestablishment, Retrieve UE Context"
CUCP,NRCellCU,CU_CELL,pmEbsUeCtxtRetrieveAttRrcReestProcedureState$,ACC,Single,,Number of attempted Retrieve UE Context procedures triggered by RRC Connection Reestablishment procedure. Separate counter is used for each procedure state.,Stepped when XnAP RETRIEVE UE CONTEXT REQUEST message is received and UE Context is found in the last serving gNodeB.,CuCpProcXnRetrieveUeCtxt,procedure_state,"PlmnId, PrefUeGrpId, UeGrpId","USED, USED, USED","Low-band, Mid-band",NR SA,,PI,Retainability,"RRC Connection Reestablishment, Retrieve UE Context"
CUCP,NRCellCU,CU_CELL,pmEbsUeCtxtRetrieveRrcReestResult$,ACC,Single,,"Number of attempted Retrieve UE Context procedures triggered by RRC Connection Re-Establishment procedure. See 3GPP TS 38.423, Retrieve UE Context Request. Separate counter for each result. See Lists and Delta Lists in CPI Library for applicable results.","Stepped when XnAP Retrieve UE Context procedure ends, which is initiated by reception of XnAP RETRIEVE UE CONTEXT REQUEST message.",CuCpProcXnRetrieveUeCtxt,retrieve_ue_ctxt_result,"PlmnId, PrefUeGrpId, UeGrpId","USED, USED, USED","Low-band, Mid-band",NR SA,,PI,Retainability,"RRC Connection Reestablishment, Retrieve UE Context"
CUCP,NRCellCU,CU_CELL,pmEbsUeCtxtRetrieveSuccRrcReest,ACC,Single,,"Number of successfully completed Retrieve UE Context procedures triggered by RRC Connection Reestablishment procedure. See 3GPP TS 38.423, Retrieve UE Context Response.",Stepped when XnAP UE CONTEXT RELEASE message is received from target gNodeB after successful Retrieve UE Context procedure initiated by RRC Connection Reestablishment procedure.,CuCpProcXnRetrieveUeCtxt,,"PlmnId, PrefUeGrpId, UeGrpId","USED, USED, USED","Low-band, Mid-band",NR SA,,PI,Retainability,"RRC Connection Reestablishment, Retrieve UE Context"
CUCP,NRCellCU,CU_CELL,pmEbsUeCtxtRetrieveSuccRrcReestProcedureState$,ACC,Single,,Number of successfully completed Retrieve UE Context procedures triggered by RRC Connection Reestablishment procedure. Separate counter is used for each procedure state.,Stepped when XnAP UE CONTEXT RELEASE message is received from target gNodeB after successful Retrieve UE Context procedure initiated by RRC connection reestablishment.,CuCpProcXnRetrieveUeCtxt,procedure_state,"PlmnId, PrefUeGrpId, UeGrpId","USED, USED, USED","Low-band, Mid-band",NR SA,,PI,Retainability,"RRC Connection Reestablishment, Retrieve UE Context"
CUCP,NRCellRelation,CUCP_CELL_RELATION,pmEbsEndcPSCellChangeAttInterSgnb,ACC,Single,,"Number of inter-gNodeB PSCell change attempts for EN-DC in source NR cell that are not interrupted by MeNodeB initiated procedure, for example, MN mobility. See 3GPP TS 37.340 for definition of PSCell.",Stepped when source NR cell sends X2AP SGNB CHANGE REQUIRED message to MeNodeB. Attempts that are aborted because of collision with MeNodeB initiated procedure are excluded.,CuCpProcX2SgnbChange,,"PrefUeGrpId, UeGrpId, UeMobilityGrpId, UeServiceGrpId, PlmnId, MeasTriggerQuantity","USED, USED, USED, USED, USED, USED","Low-band, Mid-band, High-band",EN-DC,,KPI,Mobility,E-UTRA and NR: Dual Connectivity
CUCP,NRCellRelation,CUCP_CELL_RELATION,pmEbsEndcPSCellChangeAttInterSgnbIntraF,ACC,Single,,"Number of inter-gNodeB intra-frequency PSCell change attempts for EN-DC in source NR cell that are not interrupted by MeNodeB initiated procedure, for example, MN mobility. See 3GPP TS 37.340 for definition of PSCell.",Stepped when source NR cell sends X2AP SGNB CHANGE REQUIRED message to MeNodeB. Attempts that are aborted because of collision with MeNodeB initiated procedure are excluded.,CuCpProcX2SgnbChange,,"PrefUeGrpId, UeGrpId, UeMobilityGrpId, UeServiceGrpId, PlmnId, MeasTriggerQuantity","USED, USED, USED, USED, USED, USED","Low-band, Mid-band, High-band",EN-DC,,PI,Mobility,E-UTRA and NR: Dual Connectivity
CUCP,NRCellRelation,CUCP_CELL_RELATION,pmEbsEndcPSCellChangeAttIntraSgnb,ACC,Single,,"Number of intra-gNodeB PSCell change attempts for EN-DC in source NR cell that are not interrupted by MeNodeB initiated procedure, for example, MN mobility. See 3GPP TS 37.340 for definition of PSCell.",Stepped at transmission of X2AP SGNB MODIFICATION REQUIRED message with SCG Mobility cause. Attempts that are aborted because of collision with MeNodeB initiated procedure are excluded.,CuCpProcX2SnInitiatedSgnbModification,,"PrefUeGrpId, UeGrpId, UeMobilityGrpId, UeServiceGrpId, PlmnId, UeAdmissionGrpId, UeAdmissionPriority, MeasTriggerQuantity","USED, USED, USED, USED, USED, USED, USED, USED","Low-band, Mid-band, High-band",EN-DC,,KPI,Mobility,E-UTRA and NR: Dual Connectivity
CUCP,NRCellRelation,CUCP_CELL_RELATION,pmEbsEndcPSCellChangeAttIntraSgnbIntraF,ACC,Single,,"Number of intra-gNodeB intra-frequency PSCell change attempts for EN-DC in source NR cell that are not interrupted by MeNodeB initiated procedure, for example, MN mobility. See 3GPP TS 37.340 for definition of PSCell.",Stepped at transmission of X2AP SGNB MODIFICATION REQUIRED message with SCG Mobility cause. Attempts that are aborted because of collision with MeNodeB initiated procedure are excluded.,CuCpProcX2SnInitiatedSgnbModification,,"PrefUeGrpId, UeGrpId, UeMobilityGrpId, UeServiceGrpId, PlmnId, UeAdmissionGrpId, UeAdmissionPriority, MeasTriggerQuantity","USED, USED, USED, USED, USED, USED, USED, USED","Low-band, Mid-band, High-band",EN-DC,,PI,Mobility,E-UTRA and NR: Dual Connectivity
CUCP,NRCellRelation,CUCP_CELL_RELATION,pmEbsEndcPSCellChangeSuccInterSgnb,ACC,Single,,Number of successful inter-gNodeB PSCell changes for EN-DC in source NR cell. See 3GPP TS 37.340 for definition of PSCell.,Stepped at reception of X2AP SGNB CHANGE CONFIRM message from MeNodeB. Does not depend on RRCReconfigurationComplete message from UE.,CuCpProcX2SgnbChange,,"PrefUeGrpId, UeGrpId, UeMobilityGrpId, UeServiceGrpId, PlmnId, MeasTriggerQuantity","USED, USED, USED, USED, USED, USED","Low-band, Mid-band, High-band",EN-DC,,KPI,Mobility,E-UTRA and NR: Dual Connectivity
CUCP,NRCellRelation,CUCP_CELL_RELATION,pmEbsEndcPSCellChangeSuccInterSgnbIntraF,ACC,Single,,Number of successful inter-gNodeB intra-frequency PSCell changes for EN-DC in source NR cell. See 3GPP TS 37.340 for definition of PSCell.,Stepped at reception of X2AP SGNB CHANGE CONFIRM message from MeNodeB. Does not depend on RRCReconfigurationComplete message received from UE.,CuCpProcX2SgnbChange,,"PrefUeGrpId, UeGrpId, UeMobilityGrpId, UeServiceGrpId, PlmnId, MeasTriggerQuantity","USED, USED, USED, USED, USED, USED","Low-band, Mid-band, High-band",EN-DC,,PI,Mobility,E-UTRA and NR: Dual Connectivity
CUCP,NRCellRelation,CUCP_CELL_RELATION,pmEbsEndcPSCellChangeSuccIntraSgnb,ACC,Single,,Number of successful intra-gNodeB PSCell changes for EN-DC in source NR cell. See 3GPP TS 37.340 for definition of PSCell.,Stepped at reception of SGNB MODIFICATION CONFIRM message from MeNodeB indicating RRCReconfigurationComplete message from UE.,CuCpProcX2SnInitiatedSgnbModification,,"PrefUeGrpId, UeGrpId, UeMobilityGrpId, UeServiceGrpId, PlmnId, UeAdmissionGrpId, UeAdmissionPriority, MeasTriggerQuantity","USED, USED, USED, USED, USED, USED, USED, USED","Low-band, Mid-band, High-band",EN-DC,,KPI,Mobility,E-UTRA and NR: Dual Connectivity
CUCP,NRCellRelation,CUCP_CELL_RELATION,pmEbsEndcPSCellChangeSuccIntraSgnbIntraF,ACC,Single,,Number of successful intra-gNodeB intra-frequency PSCell changes for EN-DC in source NR cell. See 3GPP TS 37.340 for definition of PSCell.,Stepped at reception of SGNB MODIFICATION CONFIRM message from MeNodeB indicating RRCReconfigurationComplete message from UE.,CuCpProcX2SnInitiatedSgnbModification,,"PrefUeGrpId, UeGrpId, UeMobilityGrpId, UeServiceGrpId, PlmnId, UeAdmissionGrpId, UeAdmissionPriority, MeasTriggerQuantity","USED, USED, USED, USED, USED, USED, USED, USED","Low-band, Mid-band, High-band",EN-DC,,PI,Mobility,E-UTRA and NR: Dual Connectivity
CUCP,NRCellRelation,CUCP_CELL_RELATION,pmEbsHoExeAttOutInterGnb,ACC,Single,,Number of outgoing NR inter-gNodeB NG or Xn handover execution attempts in source NR cell.,Stepped at transmission of RRC RRCReconfiguration message.,CuCpProcNrHoExeOut,,"PrefUeGrpId, UeGrpId, UeMobilityGrpId, UeServiceGrpId, UePowerClass, NrDcConfigured, PlmnId, TrafficSteeringType, TrafficOffloadType, MeasTriggerQuantity","USED, USED, USED, USED, USED, USED, USED, USED, USED, USED","Low-band, Mid-band",NR SA,,KPI,Mobility,Inter-gNodeB Handover
